{"incidentId":"incident-011","targetId":"target-003","policyKey":"policy-003-v2","ruleId":"rule-provider-compromise","resourceId":"provider:A","reporter":"0x5555555555555555555555555555555555555555","judge":"0x4444444444444444444444444444444444444444","evidenceHash":"0xdeadbeef02","conditionCode":"PROVIDER_COMPROMISE_V1","status":"FINAL_CONFIRMED","createdAt":"2026-09-01T00:00:00Z","closedAt":null}
