{"incidentId":"incident-011","targetId":"target-003","policyKey":"policy-003-v2","ruleId":"rule-remediation-confirmed","resourceId":"provider:A","reporter":"0x5555555555555555555555555555555555555555","judge":"0x4444444444444444444444444444444444444444","evidenceHash":"0xdeadbeef05","conditionCode":"REMEDIATION_CONFIRMED_V1","status":"RECOVERY","createdAt":"2026-09-01T00:00:00Z","closedAt":null}
